{"$id":"https://awesome-theorems.invalid/schemas/stage5-theorem-master-acceptance-1.0.json","$schema":"https://json-schema.org/draft/2020-12/schema","additionalProperties":false,"properties":{"accepted_at":{"format":"date-time","minLength":1,"pattern":"^.+Z$","type":"string"},"authority_sha256":{"minLength":1,"pattern":"^[0-9a-f]{64}$","type":"string"},"handoff":{"additionalProperties":false,"properties":{"baseline_sha256":{"minLength":1,"pattern":"^[0-9a-f]{64}$","type":"string"},"claim_card_sha256":{"minLength":1,"pattern":"^[0-9a-f]{64}$","type":"string"},"claim_id":{"minLength":1,"pattern":"^[A-Za-z0-9][A-Za-z0-9._:@-]{0,199}$","type":"string"},"immutable_archive_path":{"minLength":1,"type":"string"},"immutable_archive_sha256":{"minLength":1,"pattern":"^[0-9a-f]{64}$","type":"string"},"patch_sha256":{"minLength":1,"pattern":"^[0-9a-f]{64}$","type":"string"},"run_id":{"minLength":1,"pattern":"^[A-Za-z0-9][A-Za-z0-9._:@-]{0,199}$","type":"string"},"worker_result_sha256":{"minLength":1,"pattern":"^[0-9a-f]{64}$","type":"string"}},"required":["claim_id","run_id","claim_card_sha256","worker_result_sha256","baseline_sha256","patch_sha256","immutable_archive_path","immutable_archive_sha256"],"type":"object"},"integration":{"additionalProperties":false,"properties":{"integrated_bytes_sha256":{"minLength":1,"pattern":"^[0-9a-f]{64}$","type":"string"},"integrated_files":{"items":{"additionalProperties":false,"properties":{"path":{"minLength":1,"type":"string"},"sha256":{"minLength":1,"pattern":"^[0-9a-f]{64}$","type":"string"},"size_bytes":{"minimum":0,"type":"integer"}},"required":["path","sha256","size_bytes"],"type":"object"},"minItems":1,"type":"array","uniqueItems":true},"post_tree_sha256":{"minLength":1,"pattern":"^[0-9a-f]{64}$","type":"string"},"pre_tree_sha256":{"minLength":1,"pattern":"^[0-9a-f]{64}$","type":"string"}},"required":["pre_tree_sha256","post_tree_sha256","integrated_bytes_sha256","integrated_files"],"type":"object"},"item_id":{"minLength":1,"pattern":"^[A-Za-z0-9][A-Za-z0-9._:@-]{0,199}$","type":"string"},"master":{"additionalProperties":false,"properties":{"authentication_sha256":{"minLength":1,"pattern":"^[0-9a-f]{64}$","type":"string"},"decision_id":{"minLength":1,"pattern":"^[A-Za-z0-9][A-Za-z0-9._:@-]{0,199}$","type":"string"},"principal_id":{"minLength":1,"pattern":"^[A-Za-z0-9][A-Za-z0-9._:@-]{0,199}$","type":"string"}},"required":["principal_id","decision_id","authentication_sha256"],"type":"object"},"mode":{"minLength":1,"pattern":"^[A-Z][A-Z0-9-]{0,63}$","type":"string"},"program":{"minLength":1,"type":"string"},"review_decisions":{"items":{"additionalProperties":false,"properties":{"decision":{"const":"accepted","minLength":1,"type":"string"},"decision_receipt_path":{"minLength":1,"type":"string"},"decision_receipt_sha256":{"minLength":1,"pattern":"^[0-9a-f]{64}$","type":"string"},"reviewer_id":{"minLength":1,"pattern":"^[A-Za-z0-9][A-Za-z0-9._:@-]{0,199}$","type":"string"}},"required":["reviewer_id","decision","decision_receipt_path","decision_receipt_sha256"],"type":"object"},"minItems":1,"type":"array","uniqueItems":true},"schema_version":{"const":"awesome-theorems/stage5-proof-debt-master-acceptance/1.0","minLength":1,"type":"string"},"state_transition":{"additionalProperties":false,"properties":{"from":{"const":"handoff_waiting_master","minLength":1,"type":"string"},"post_blueprint_sha256":{"minLength":1,"pattern":"^[0-9a-f]{64}$","type":"string"},"post_gantt_sha256":{"minLength":1,"pattern":"^[0-9a-f]{64}$","type":"string"},"pre_blueprint_sha256":{"minLength":1,"pattern":"^[0-9a-f]{64}$","type":"string"},"to":{"const":"master_accepted","minLength":1,"type":"string"}},"required":["from","to","pre_blueprint_sha256","post_blueprint_sha256","post_gantt_sha256"],"type":"object"},"validation_gates":{"items":{"additionalProperties":false,"properties":{"command_sha256":{"minLength":1,"pattern":"^[0-9a-f]{64}$","type":"string"},"exit_code":{"const":0,"minimum":0,"type":"integer"},"gate_id":{"minLength":1,"pattern":"^[A-Za-z0-9][A-Za-z0-9._:@-]{0,199}$","type":"string"},"passed":{"const":true,"type":"boolean"},"stderr_sha256":{"minLength":1,"pattern":"^[0-9a-f]{64}$","type":"string"},"stdout_sha256":{"minLength":1,"pattern":"^[0-9a-f]{64}$","type":"string"}},"required":["gate_id","command_sha256","exit_code","passed","stdout_sha256","stderr_sha256"],"type":"object"},"minItems":1,"type":"array","uniqueItems":true}},"required":["schema_version","program","item_id","mode","master","handoff","review_decisions","integration","validation_gates","state_transition","accepted_at","authority_sha256"],"type":"object"}