{
  "accepted_at": "2026-08-17T12:18:36Z",
  "authority_sha256": "f70a01d1b02d68e645c3d2f9ac1814b59d04bfb16e56eb4999fb496de27600d7",
  "handoff": {
    "baseline_sha256": "f4b8783fdb0605a6e19f6df2c05621d3a3345c34749ab3426ccd05a96352aeba",
    "claim_card_sha256": "b4422e4ee4d8512ccfe99e3e525daf66fa59161e193ace04d99ac5f7ed2e3fbd",
    "claim_id": "S5THM-00003536-TARGET--worker",
    "immutable_archive_path": ".ops/stage5-theorems-execution-v2/handoffs/S5THM-00003536-TARGET--worker/f4b8783fdb0605a6e19f6df2c05621d3a3345c34749ab3426ccd05a96352aeba/f9e66b4e8d006b09d932b7b2ae7671fbd54701af90494978c79c4bc0286e69f1",
    "immutable_archive_sha256": "a5757a337de09680bf6c675bd9b93852c5e95dc22ad06e512cc133e896453c4e",
    "patch_sha256": "f9e66b4e8d006b09d932b7b2ae7671fbd54701af90494978c79c4bc0286e69f1",
    "run_id": "r-1786962489-1319f0ee",
    "worker_result_sha256": "405882dcf7028d65aa7c5c7fee54d126f22f370ffd46d450b6952f3cf3fa6282"
  },
  "integration": {
    "integrated_bytes_sha256": "f40d66d249f72abbf651b4878374a95d18d573560dedd677e4e0b000e27e6e6b",
    "integrated_files": [
      {
        "path": "Stage5_Theorem_Instances/S5-CLM-00003536/intake.json",
        "sha256": "8c82f0086f041fb44b8d1bb86108fdf8fd62bd23a196cb1c5a29fe3576f4db68",
        "size_bytes": 1642
      },
      {
        "path": "Formalizations/Lean/AwesomeTheorems/Stage5/Theorems/S5_CLM_00003536/Statement.lean",
        "sha256": "9e90f6749aa812d7601a93ffba7f4d6f00bd548ac98f16af764e9b6787385d57",
        "size_bytes": 1366
      },
      {
        "path": "Stage5_Theorem_Instances/S5-CLM-00003536/statement-crosswalk.json",
        "sha256": "8080a7ee6f89f9d29936475f9a367b5100dc5a9d57331e3f94eb38062a6c220d",
        "size_bytes": 2765
      },
      {
        "path": "Stage5_Theorem_Instances/S5-CLM-00003536/anchor-audit.json",
        "sha256": "ef5c4f9a11e1987d0fe1190ecf3b1fc87798f0d29b603ce9f4e344d84c2df817",
        "size_bytes": 1219
      },
      {
        "path": "Stage5_Theorem_Instances/S5-CLM-00003536/proof-units.json",
        "sha256": "6ff835bc7b572c24810cc34722e609cafccdef0af71b8fcc5aa4750d533df319",
        "size_bytes": 2084
      },
      {
        "path": "Stage5_Theorem_Instances/S5-CLM-00003536/process-audit.md",
        "sha256": "48dabe54cc5a643c87a970bae87aa6378c60fd1d8d85767b901b53fdf8eb1f6f",
        "size_bytes": 1004
      },
      {
        "path": "Formalizations/Lean/AwesomeTheorems/Stage5/Theorems/S5_CLM_00003536/Proof.lean",
        "sha256": "d793c0d40865bda42d4656f3132db35c5a2c517da6722ee4ee10b1dc94191431",
        "size_bytes": 1065
      },
      {
        "path": "Stage5_Theorem_Instances/S5-CLM-00003536/machine-closure.json",
        "sha256": "77f6ba8937cd6524276a7985e61ae70c654bddfc2c7cab4377285051d8f4ddc4",
        "size_bytes": 1167
      },
      {
        "path": "Stage5_Theorem_Instances/S5-CLM-00003536/machine-checked-audit.md",
        "sha256": "247ad579283930263c801f090a45d0628800b7e8e05901ef64cd9995aa9065e4",
        "size_bytes": 815
      },
      {
        "path": "Stage5_Theorem_Instances/S5-CLM-00003536/proof-outline.md",
        "sha256": "b93a5572f3707bc92f1753da0be1b687e621ad9c3b5f9449252b67e6c73ae3f5",
        "size_bytes": 1258
      },
      {
        "path": "Stage5_Theorem_Instances/S5-CLM-00003536/full-study.md",
        "sha256": "04503a9adb69f338583ba3d233ee479a197533e14ed76a81e05b49500940847f",
        "size_bytes": 5074
      },
      {
        "path": "Stage5_Theorem_Instances/S5-CLM-00003536/readability-review.json",
        "sha256": "9ed1df38e20d61c4e2b00dd25e27e588ddb8753c261413b161c7525fa0772c04",
        "size_bytes": 5333
      },
      {
        "path": "Formalizations/Lean/AwesomeTheorems/Stage5/Theorems/S5_CLM_00003536/Audit.lean",
        "sha256": "6511f7de9bb4193c4222cca1dae73090db9240cf20d30d36db0de2780cc04a75",
        "size_bytes": 1378
      },
      {
        "path": "Stage5_Theorem_Instances/S5-CLM-00003536/build-validation.md",
        "sha256": "602ec76b9507b9b56c313d5561aed1284287fc42c5fa72bba39ab42e49c82538",
        "size_bytes": 738
      },
      {
        "path": "Stage5_Theorem_Instances/S5-CLM-00003536/receipts/current-validation.json",
        "sha256": "de9fa8af07f95873ece13b005ead49cdd58e9d0ecb4808d032a12f1e6f151606",
        "size_bytes": 847
      },
      {
        "path": "Stage5_Theorem_Instances/S5-CLM-00003536/README.md",
        "sha256": "7847982b725c4e002df17044549a2f68873dc43158c02f983263fa2721931f0c",
        "size_bytes": 908
      },
      {
        "path": "Stage5_Theorem_Instances/S5-CLM-00003536/meta.json",
        "sha256": "da992beac96e245a4bee87f6ec368b7534f8a068e1a54d8fcd399fa49e53f4ee",
        "size_bytes": 624
      },
      {
        "path": "Stage5_Theorem_Instances/S5-CLM-00003536/receipts/release-decision.json",
        "sha256": "d152f44f0faab4f4fcbcd82ef8cd54230d0c60570a64c0a88412b93c3eba7b6e",
        "size_bytes": 1267
      }
    ],
    "post_tree_sha256": "b24c310da664e168d0e8b919e3f11f748c6bca913dad2db9f78dd10de271181e",
    "pre_tree_sha256": "19aeaa8bf37424ee2bdc66836fbe229fa261b4f9d3eefc4849eafef6bc75a04e"
  },
  "item_id": "S5THM-00003536-TARGET",
  "master": {
    "authentication_sha256": "548b5f75503d0cd5d17dbc21a70fdd02c7dab6cab670cf4458c9559972b62147",
    "decision_id": "master-s5thm-00003536-target-b8028b336bf0daed",
    "principal_id": "codex-user-goal:01a00af8-9991-79e2-819b-f36effd4313d"
  },
  "mode": "TARGET-TARGET",
  "program": "stage5-theorem-proof-debt/2.0",
  "review_decisions": [
    {
      "decision": "accepted",
      "decision_receipt_path": ".ops/stage5-theorems-execution-v2/handoffs/S5THM-00003536-TARGET--worker/f4b8783fdb0605a6e19f6df2c05621d3a3345c34749ab3426ccd05a96352aeba/f9e66b4e8d006b09d932b7b2ae7671fbd54701af90494978c79c4bc0286e69f1/harvest-manifest.json",
      "decision_receipt_sha256": "a5757a337de09680bf6c675bd9b93852c5e95dc22ad06e512cc133e896453c4e",
      "reviewer_id": "canonical-master-validator"
    }
  ],
  "schema_version": "awesome-theorems/stage5-proof-debt-master-acceptance/1.0",
  "state_transition": {
    "from": "handoff_waiting_master",
    "post_blueprint_sha256": "b8028b336bf0daed4a64df2c2272cd291c784446fec30fc1f4be7702ff88443e",
    "post_gantt_sha256": "de0009ec1d8cdb5e07f2921dd98b61e5cb14bc19b0d19ef5cafc1a95edaa2335",
    "pre_blueprint_sha256": "2c142775518ea27ebda86907bc5ae4b40df1e3ee88391def2bd4af494d781a1b",
    "to": "master_accepted"
  },
  "validation_gates": [
    {
      "command_sha256": "bfbe246590a18c036436a283b67f2ec377b288a2ef63e4c185ae457600677a9c",
      "exit_code": 0,
      "gate_id": "mode-specific-master-validator",
      "passed": true,
      "stderr_sha256": "e3b0c44298fc1c149afbf4c8996fb92427ae41e4649b934ca495991b7852b855",
      "stdout_sha256": "668c09e17b31471a7cbc72b85fbcbc1233938eb6408d25a8540c93f2eec77b46"
    }
  ]
}
