{
  "accepted_at": "2026-08-14T04:27:59Z",
  "authority_sha256": "7a3c43026b30f1b01c76b1f13a1292f1607566b837071bccd30e3840cebdfa7c",
  "handoff": {
    "baseline_sha256": "473c7f66188160f5c3e178cdd4393ce995aeb43937f1c35f882d87e244c37db6",
    "claim_card_sha256": "614faa79a2aa354930bf1bd6d6c488937585957f0d700174310211eecc79d7d6",
    "claim_id": "S5THM-00003556-TARGET--worker",
    "immutable_archive_path": ".ops/stage5-theorems-execution-v2/handoffs/S5THM-00003556-TARGET--worker/473c7f66188160f5c3e178cdd4393ce995aeb43937f1c35f882d87e244c37db6/4a8d0fdff46fe1e7b90d4e018ce78152f384ee8df321166d6ec1eafab475b4a4",
    "immutable_archive_sha256": "75d1781b741134fc41728b1cc577f935da0fa70f66dfefea929977f0ef82c1e2",
    "patch_sha256": "4a8d0fdff46fe1e7b90d4e018ce78152f384ee8df321166d6ec1eafab475b4a4",
    "run_id": "r-1786678212-84fa325e",
    "worker_result_sha256": "e2f61ec23dfac79f6a9dcd0bd58bdecfe35ddab4e0f129448e4141e3c5dc2652"
  },
  "integration": {
    "integrated_bytes_sha256": "e6b1b98b657162c35a185c3b5007e495a1d1da5748352f0b13bc144d5e71fde0",
    "integrated_files": [
      {
        "path": "Stage5_Theorem_Instances/S5-CLM-00003556/intake.json",
        "sha256": "2d4450374f6623c0e16d79434ea081bd097bc298420b5a24a81765aebfa4532e",
        "size_bytes": 959
      },
      {
        "path": "Formalizations/Lean/AwesomeTheorems/Stage5/Theorems/S5_CLM_00003556/Statement.lean",
        "sha256": "44d2b53b2c68920f1b3a92582997c24793ef5224527a116f4c3fbd698a0a0333",
        "size_bytes": 516
      },
      {
        "path": "Stage5_Theorem_Instances/S5-CLM-00003556/statement-crosswalk.json",
        "sha256": "47010aef7a8832cd4210df0cb6b14389541e032974bcbd2652d7631ad8b3de16",
        "size_bytes": 2716
      },
      {
        "path": "Stage5_Theorem_Instances/S5-CLM-00003556/anchor-audit.json",
        "sha256": "44a7fa64488ea2b2f05fcd638790e6cea3fcc5ca69dfdc3ace4f2c5f5755584b",
        "size_bytes": 851
      },
      {
        "path": "Stage5_Theorem_Instances/S5-CLM-00003556/proof-units.json",
        "sha256": "d6681e1e04e9d99821b491a10bd7a1e9240910bbcbfa84fa8e7c96a575973b8e",
        "size_bytes": 3427
      },
      {
        "path": "Stage5_Theorem_Instances/S5-CLM-00003556/process-audit.md",
        "sha256": "60381e1a9938e978916943c6da17697b5303f3c058d36fef02ea2083b4b7a922",
        "size_bytes": 823
      },
      {
        "path": "Formalizations/Lean/AwesomeTheorems/Stage5/Theorems/S5_CLM_00003556/Proof.lean",
        "sha256": "d619c2c978713c06821f85b41c7b951c4e3d830f8c3a03c8424f1cae34a8fba8",
        "size_bytes": 520
      },
      {
        "path": "Stage5_Theorem_Instances/S5-CLM-00003556/machine-closure.json",
        "sha256": "8ea3195e23f7efe799668f4ac95c5b198adac561d8f808f0aa8305682177709e",
        "size_bytes": 1392
      },
      {
        "path": "Stage5_Theorem_Instances/S5-CLM-00003556/machine-checked-audit.md",
        "sha256": "f12fd5f9af96098c07968bcd29e81ada00d1ee057974a685e915e25096a08caf",
        "size_bytes": 648
      },
      {
        "path": "Stage5_Theorem_Instances/S5-CLM-00003556/proof-outline.md",
        "sha256": "0f421703e71f84bcfa2ab86b3aa637bb15352e10e2fde51eda91730cd8668da9",
        "size_bytes": 661
      },
      {
        "path": "Stage5_Theorem_Instances/S5-CLM-00003556/full-study.md",
        "sha256": "6ddf8f9e7c844c0b7193b6b77db58b5c64fc2e4d191c0c81df803e80a8cf6c16",
        "size_bytes": 1709
      },
      {
        "path": "Stage5_Theorem_Instances/S5-CLM-00003556/readability-review.json",
        "sha256": "306090b6b14f1300a745755b346c1619547f3022f62de8ef3512e44fd1dce2cc",
        "size_bytes": 4959
      },
      {
        "path": "Formalizations/Lean/AwesomeTheorems/Stage5/Theorems/S5_CLM_00003556/Audit.lean",
        "sha256": "8a8d419a44989849a4980efa8159864a25a0f3d116f50e5481398f63cfd6a138",
        "size_bytes": 624
      },
      {
        "path": "Stage5_Theorem_Instances/S5-CLM-00003556/build-validation.md",
        "sha256": "b24951b494285907cf595656cdc43c8e0cbb6f60d31d9ab4623bda0e40b4e0ae",
        "size_bytes": 518
      },
      {
        "path": "Stage5_Theorem_Instances/S5-CLM-00003556/receipts/current-validation.json",
        "sha256": "2497a3785c1ce5534f08332b5212474e0c370b0b9ec3be1b932ca17be3ae2c6e",
        "size_bytes": 871
      },
      {
        "path": "Stage5_Theorem_Instances/S5-CLM-00003556/README.md",
        "sha256": "7224ac3db5faacb3f3072555c577e8ba2d605bfdace913ed3378df415c1eda2d",
        "size_bytes": 681
      },
      {
        "path": "Stage5_Theorem_Instances/S5-CLM-00003556/meta.json",
        "sha256": "f2dd7fc131fc3f65c0d3f591e4d5c70f5c9a2cb98a550f92c78e7102dc6dc645",
        "size_bytes": 579
      },
      {
        "path": "Stage5_Theorem_Instances/S5-CLM-00003556/receipts/release-decision.json",
        "sha256": "f50ee3f115dd302175838b052c2efc30b7be57be15e2fe03b0e31c7c3a53d502",
        "size_bytes": 1249
      }
    ],
    "post_tree_sha256": "f84a9622a24fe39ff6220beefaabf067ac444859cd3a6af6f1c6735295ba3947",
    "pre_tree_sha256": "40396cfd597c8899e8ff7b1bfa29cdc04a81e4a46c6159865af53881f0f14dfb"
  },
  "item_id": "S5THM-00003556-TARGET",
  "master": {
    "authentication_sha256": "8b2aed379255252ca6b64ee1b83136ab2f1866fb966c6a1374e7058e93de5b98",
    "decision_id": "master-s5thm-00003556-target-a92470dd43befa1f",
    "principal_id": "codex-user-goal:019ffb07-dd55-7e03-b0f1-1b8ebe8ba4a8"
  },
  "mode": "TARGET-TARGET",
  "program": "stage5-theorem-proof-debt/2.0",
  "review_decisions": [
    {
      "decision": "accepted",
      "decision_receipt_path": ".ops/stage5-theorems-execution-v2/handoffs/S5THM-00003556-TARGET--worker/473c7f66188160f5c3e178cdd4393ce995aeb43937f1c35f882d87e244c37db6/4a8d0fdff46fe1e7b90d4e018ce78152f384ee8df321166d6ec1eafab475b4a4/harvest-manifest.json",
      "decision_receipt_sha256": "75d1781b741134fc41728b1cc577f935da0fa70f66dfefea929977f0ef82c1e2",
      "reviewer_id": "canonical-master-validator"
    }
  ],
  "schema_version": "awesome-theorems/stage5-proof-debt-master-acceptance/1.0",
  "state_transition": {
    "from": "handoff_waiting_master",
    "post_blueprint_sha256": "a92470dd43befa1f5a8d545bbcaf271e0069c4773d1d8be86964a9282d8153da",
    "post_gantt_sha256": "940562fd942eb9a226be2f5d780adde27a8a6c5d5f4b1547d75ed0db9aa5df44",
    "pre_blueprint_sha256": "9d75d28880417fa71936c15c48422773de253ae19fdc9d659a2819acd94cfe1a",
    "to": "master_accepted"
  },
  "validation_gates": [
    {
      "command_sha256": "377e36913f9e724758e6471c52cb9d9ef46be01ee64011143d6353f6ce4e34d4",
      "exit_code": 0,
      "gate_id": "mode-specific-master-validator",
      "passed": true,
      "stderr_sha256": "e3b0c44298fc1c149afbf4c8996fb92427ae41e4649b934ca495991b7852b855",
      "stdout_sha256": "7d972b4df3e6665f3bde62c364712ae1c58ad4a35960d109b0e9bb045dce8627"
    }
  ]
}
